{
  "identifier": "USR-000042",
  "parentIdentifier": "FEAT-000010",
  "module": "MOD-006",
  "enterprisePhase": "PH-003",
  "title": "Record individual savings collection in pesewas",
  "description": "Cashier records a daily collection posting for an individual savings account.",
  "businessObjective": "Ensure collection posts preserve money invariants.",
  "businessValue": "Accurate customer balances and GL integrity.",
  "priority": "Critical",
  "riskLevel": "High",
  "complexity": "M",
  "storyPoints": 5,
  "estimatedHours": 12,
  "owner": "CIO",
  "team": "Domain",
  "status": "Completed",
  "dependencies": {
    "prerequisites": ["TASK-000015"],
    "dependentTasks": [],
    "blockingTasks": [],
    "relatedTasks": [],
    "crossModule": ["MOD-010"],
    "crossPhase": ["PH-016"]
  },
  "blockers": [],
  "acceptanceCriteria": [
    "Amounts stored as integer pesewas",
    "Default interest 15% unchanged",
    "Collection cycle remains 31 days",
    "Cashier float limit 1000 enforced"
  ],
  "validationRequirements": ["Money invariant regression pack"],
  "testCases": ["TC-MOD-006-COLLECT-01"],
  "uiScreens": ["collections-entry"],
  "apis": [],
  "databaseTables": ["savings_transactions"],
  "databaseViews": [],
  "databaseFunctions": [],
  "storedProcedures": [],
  "reports": [],
  "dashboards": [],
  "securityControls": ["RBAC:cashier"],
  "auditRequirements": ["posting audit event"],
  "offlineSupport": "Partial",
  "synchronizationRequirements": "Queue offline posts for Module 15 sync",
  "performanceRequirements": null,
  "monitoringRequirements": null,
  "documentationReferences": [
    "docs/individual-savings-collection.md",
    "docs/master-implementation-backlog.md"
  ],
  "relatedEnterprisePhaseReferences": ["PH-003", "PH-016"],
  "relatedModuleReferences": ["MOD-006", "MOD-010"],
  "version": "1.1.0",
  "createdDate": "2026-09-15",
  "modifiedDate": "2026-09-17",
  "wave": 8,
  "deliveryWave": 5,
  "workCategory": "Feature",
  "auditGapRefs": [],
  "notes": "Example valid backlog item for schema tests"
}
